{
  "version": "3.0",
  "created_at": "2026-10-17T00:00:00.000Z",
  "updated_at": "2026-10-17T00:00:00.000Z",
  "decisions": [
    {
      "id": "0001",
      "title": "Merge powerlinks into winos as a fourth module; winos becomes the container",
      "status": "accepted",
      "file": "0001-merge-powerlinks-into-winos.md",
      "date": "2026-10-17"
    }
  ]
}
